line|content|start|end
1|such a great joke|0:00:00|0:00:01.170000
2|for will avoid the pole|0:00:02.280000|0:00:03.420000
"3|yes he hears some kind of mooing, it’s unclear but a hare|0:00:04.440000|0:00:06.900000"
4|cheerfully and cheerfully with whatever you say|0:00:07.020000|0:00:08.970000
5|runs out from behind a bush and there is a trap there|0:00:09.780000|0:00:12.180000
"6|and a wolf's face fell into a trap, but|0:00:12.270000|0:00:15.570000"
7|approached wolves tail lifted dragged sang tore off|0:00:17.130000|0:00:21.780000
8|he cummed properly and gave me a|0:00:21.780000|0:00:23.789454
9|and even beautiful and even a wolf|0:00:23.789454|0:00:26.190000
10|I just went crazy there|0:00:26.190000|0:00:27.630000
"11|took his face out of this trap, rushing density|0:00:27.840000|0:00:31.470000"
12|I’ll catch up and break it|0:00:32.310000|0:00:33.300000
13|hears the chase see the swamp jumped the swamp from|0:00:33.840000|0:00:36.960000
14|swamps you know the muzzle stuck out black from such|0:00:36.960000|0:00:39.780000
15|there is only a beaver on the shore|0:00:39.900000|0:00:41.880000
16|Have you seen the hare|0:00:42.870000|0:00:43.950000
17|I don’t talk to fags|0:00:45.030000|0:00:47.520000
18|ha|0:00:50.190000|0:00:53.220000